{
  "meshes": [
    {
      "type": "Triangles",
      "path": "capsule.obj"
    },
    {
      "type": "Triangles",
      "path": "cylinder.obj"
    },
    {
      "type": "Triangles",
      "path": "monkey.obj"
    },
    {
      "type": "Triangles",
      "path": "sphere.obj"
    },
    {
      "type": "Triangles",
      "path": "ico.obj"
    }
  ],
  "shaders": ["basic", "default"],
  "textures": [
    "default.jpg",
    "CubeGridTex.png",
    "Metal01/color.jpg",
    "Metal01/normal.jpg",
    "Metal01/metallic.jpg",
    "Metal01/roughness.jpg",
    "Kenny/Dark/texture_08.png",
    "Kenny/Dark/texture_12.png",
    "Kenny/Green/texture_09.png",
    "Kenny/Green/texture_13.png",
    "Kenny/Light/texture_07.png",
    "Kenny/Light/texture_11.png",
    "Kenny/Orange/texture_09.png",
    "Kenny/Orange/texture_13.png",
    "Kenny/Purple/texture_09.png",
    "Kenny/Purple/texture_13.png",
    "Kenny/Red/texture_09.png",
    "Kenny/Red/texture_13.png",
    "icons/play.png",
    "icons/pause.png",
    "icons/reload.png",
    "icons/import.png",
    "icons/export.png",
    "white.png",
    "black.png"
  ],
  "materials": [
    {
      "name": "default",
      "shader": "basic",
      "textures": ["default.jpg"]
    },
    {
      "name": "Monkey",
      "shader": "basic",
      "textures": ["black.png"]
    },
    {
      "name": "Metal01",
      "shader": "basic",
      "textures": ["Metal01/color.jpg"]
    },
    {
      "name": "KennyDark",
      "shader": "default",
      "textures": ["Kenny/Dark/texture_08.png"]
    },
    {
      "name": "KennyGreen",
      "shader": "default",
      "textures": ["Kenny/Green/texture_09.png"]
    },
    {
      "name": "KennyLight",
      "shader": "default",
      "textures": ["Kenny/Light/texture_07.png"]
    },
    {
      "name": "KennyOrange",
      "shader": "default",
      "textures": ["Kenny/Orange/texture_09.png"]
    },
    {
      "name": "KennyPurple",
      "shader": "default",
      "textures": ["Kenny/Purple/texture_09.png"]
    },
    {
      "name": "KennyRed",
      "shader": "default",
      "textures": ["Kenny/Red/texture_09.png"]
    },
    {
      "name": "GroundMat",
      "shader": "default",
      "textures": ["CubeGridTex.png"]
    }
  ],
  "framebuffers": []
}
